Sheet: ISRAEL
A1: ISRAEL (USD)
A6: Date: Dec 25, 2017
A7: Rate Code: 1027 (EB 1023)
A8: Currency: USD $
A9: Valid: Sep 1, 2017 - Dec 19, 2019
A10: Rates include the BASIC RENTAL ONLY & EXCLUDE Protection Coverage's (Monthly rentals include the Protection Coverage's CDW, TP & 3PLC).
A12: Vehicle Group/Type | F12: Daily (1-2) Incl. 250 km per day | H12: Daily (3-6) Unlimited km | J12: Weekly Unlimited km | L12: Ex. Day (8+) Unlimited km | N12: Monthly (30+) Incl. 150 km per day | P12: Protection Coverage's | S12: Extra KM | T12: Super CDW | U12: Super CDW Monthly | V12: Super TP | W12: Super TP Monthly | X12: Excess
A13: Car Group | B13: SIPP Code | C13: Group Seq. | D13: Seats | E13: Vehicle Type | F13: Low | G13: High | H13: Low | I13: High | J13: Low | K13: High | L13: Low | M13: High | N13: Low | O13: High | P13: CDW | Q13: TP | R13: 3PLC
A14: Manual Vehicles
A15: B | B15: MBMR | C15: 10 | D15: 4 | E15: Suzuki Alto or similar | F15: 10 | G15: of:=[.F15]+12 -> 22 | H15: 10 | I15: of:=[.H15]+12 -> 22 | J15: of:=[.L15]*7 -> 63 | K15: of:=[.M15]*7 -> 147 | L15: 9 | M15: of:=[.L15]+12 -> 21 | N15: 610 | O15: of:=[.N15]+180 -> 790 | P15: 10 | Q15: 5 | R15: 12 | S15: 0.45 | T15: 10 | U15: 100 | V15: 5 | W15: 60 | X15: 475
A16: Automatic Vehicles
A17: Q | B17: EBAR | C17: 15 | D17: 4 | E17: Fiat 500 or similar (2 Doors) | F17: 10 | G17: of:=[.F17]+12 -> 22 | H17: 10 | I17: of:=[.H17]+12 -> 22 | J17: of:=[.L17]*7 -> 63 | K17: of:=[.M17]*7 -> 147 | L17: 9 | M17: of:=[.L17]+12 -> 21 | N17: 610 | O17: of:=[.N17]+180 -> 790 | P17: 10 | Q17: 5 | R17: 12 | S17: 0.45 | T17: 10 | U17: 100 | V17: 5 | W17: 60 | X17: 475
A18: C | B18: EDAR | C18: 30 | D18: 4 | E18: Kia Picanto or similar | F18: 11 | G18: of:=[.F18]+12 -> 23 | H18: 11 | I18: of:=[.H18]+12 -> 23 | J18: of:=[.L18]*7 -> 70 | K18: of:=[.M18]*7 -> 154 | L18: 10 | M18: of:=[.L18]+12 -> 22 | N18: 620 | O18: of:=[.N18]+180 -> 800 | P18: 10 | Q18: 5 | R18: 12 | S18: 0.45 | T18: 10 | U18: 100 | V18: 5 | W18: 60 | X18: 475
A19: D | B19: CBAR | C19: 20 | D19: 4 | E19: Hyundai i20 or similar | F19: 12 | G19: of:=[.F19]+12 -> 24 | H19: 12 | I19: of:=[.H19]+12 -> 24 | J19: of:=[.L19]*7 -> 77 | K19: of:=[.M19]*7 -> 161 | L19: 11 | M19: of:=[.L19]+12 -> 23 | N19: 630 | O19: of:=[.N19]+180 -> 810 | P19: 10 | Q19: 5 | R19: 12 | S19: 0.45 | T19: 10 | U19: 100 | V19: 5 | W19: 60 | X19: 475
A20: E | B20: CCAR | C20: 50 | D20: 5 | E20: Ford Fiesta or similar | F20: 13 | G20: of:=[.F20]+12 -> 25 | H20: 13 | I20: of:=[.H20]+12 -> 25 | J20: of:=[.L20]*7 -> 84 | K20: of:=[.M20]*7 -> 168 | L20: 12 | M20: of:=[.L20]+12 -> 24 | N20: 645 | O20: of:=[.N20]+180 -> 825 | P20: 10 | Q20: 5 | R20: 12 | S20: 0.45 | T20: 10 | U20: 100 | V20: 5 | W20: 60 | X20: 475
A21: F | B21: IDAR | C21: 60 | D21: 5 | E21: Hyundai Accent i25 or similar | F21: 16 | G21: of:=[.F21]+12 -> 28 | H21: 16 | I21: of:=[.H21]+12 -> 28 | J21: of:=[.L21]*7 -> 98 | K21: of:=[.M21]*7 -> 182 | L21: 14 | M21: of:=[.L21]+12 -> 26 | N21: 750 | O21: of:=[.N21]+180 -> 930 | P21: 11 | Q21: 5 | R21: 12 | S21: 0.5 | T21: 10 | U21: 100 | V21: 5 | W21: 60 | X21: 475
A22: I | B22: SCAR | C22: 90 | D22: 5 | E22: VW Golf or similar | F22: 18 | G22: of:=[.F22]+12 -> 30 | H22: 18 | I22: of:=[.H22]+12 -> 30 | J22: of:=[.L22]*7 -> 112 | K22: of:=[.M22]*7 -> 196 | L22: 16 | M22: of:=[.L22]+12 -> 28 | N22: 790 | O22: of:=[.N22]+180 -> 970 | P22: 11 | Q22: 5 | R22: 12 | S22: 0.5 | T22: 10 | U22: 100 | V22: 5 | W22: 60 | X22: 475
A23: IW | B23: CWAR | C23: 91 | D23: 5 | E23: Seat Leon SW or similar | F23: 20 | G23: of:=[.F23]+12 -> 32 | H23: 20 | I23: of:=[.H23]+12 -> 32 | J23: of:=[.L23]*7 -> 126 | K23: of:=[.M23]*7 -> 210 | L23: 18 | M23: of:=[.L23]+12 -> 30 | N23: 820 | O23: of:=[.N23]+180 -> 1000 | P23: 11 | Q23: 5 | R23: 12 | S23: 0.5 | T23: 10 | U23: 100 | V23: 5 | W23: 60 | X23: 475
A24: H | B24: SDAR | C24: 80 | D24: 5 | E24: VW Jetta or similar | F24: 24 | G24: of:=[.F24]+12 -> 36 | H24: 24 | I24: of:=[.H24]+12 -> 36 | J24: of:=[.L24]*7 -> 154 | K24: of:=[.M24]*7 -> 238 | L24: 22 | M24: of:=[.L24]+12 -> 34 | N24: 960 | O24: of:=[.N24]+180 -> 1140 | P24: 11 | Q24: 5 | R24: 12 | S24: 0.5 | T24: 10 | U24: 150 | V24: 5 | W24: 70 | X24: 715
A25: M | B25: PDAR | C25: 130 | D25: 5 | E25: Mazda 6 or similar | F25: 31 | G25: of:=[.F25]+15 -> 46 | H25: 31 | I25: of:=[.H25]+15 -> 46 | J25: of:=[.L25]*7 -> 196 | K25: of:=[.M25]*7 -> 301 | L25: 28 | M25: of:=[.L25]+15 -> 43 | N25: 1050 | O25: of:=[.N25]+180 -> 1230 | P25: 14 | Q25: 5 | R25: 15 | S25: 0.5 | T25: 10 | U25: 150 | V25: 7 | W25: 70 | X25: 715
A26: MH | B26: PCAR | C26: 135 | D26: 5 | E26: Hyundai Sonata or similar | F26: 42 | G26: of:=[.F26]+15 -> 57 | H26: 42 | I26: of:=[.H26]+15 -> 57 | J26: of:=[.L26]*7 -> 266 | K26: of:=[.M26]*7 -> 371 | L26: 38 | M26: of:=[.L26]+15 -> 53 | N26: 1450 | O26: of:=[.N26]+180 -> 1630 | P26: 14 | Q26: 5 | R26: 15 | S26: 0.75 | T26: 10 | U26: 150 | V26: 7 | W26: 70 | X26: 715
A27: K | B27: UDAR | C27: 110 | D27: 5 | E27: BMW 318i or similar | F27: 72 | G27: of:=[.F27]+15 -> 87 | H27: 72 | I27: of:=[.H27]+15 -> 87 | J27: of:=[.L27]*7 -> 455 | K27: of:=[.M27]*7 -> 560 | L27: 65 | M27: of:=[.L27]+15 -> 80 | N27: 1590 | O27: of:=[.N27]+180 -> 1770 | P27: 14 | Q27: 5 | R27: 15 | S27: 0.75 | T27: 10 | U27: 150 | V27: 7 | W27: 70 | X27: 715
A28: R | B28: FCAR | C28: 180 | D28: 5 | E28: VW Passat or similar | F28: 58 | G28: of:=[.F28]+15 -> 73 | H28: 58 | I28: of:=[.H28]+15 -> 73 | J28: of:=[.L28]*7 -> 364 | K28: of:=[.M28]*7 -> 469 | L28: 52 | M28: of:=[.L28]+15 -> 67 | N28: 1640 | O28: of:=[.N28]+180 -> 1820 | P28: 14 | Q28: 5 | R28: 15 | S28: 0.75 | T28: 15 | U28: 210 | V28: 10 | W28: 90 | X28: 960
A29: P | B29: LDAR | C29: 160 | D29: 5 | E29: Nissan Maxima or similar | F29: 79 | G29: of:=[.F29]+30 -> 109 | H29: 79 | I29: of:=[.H29]+30 -> 109 | J29: of:=[.L29]*7 -> 497 | K29: of:=[.M29]*7 -> 707 | L29: 71 | M29: of:=[.L29]+30 -> 101 | N29: 2170 | O29: of:=[.N29]+240 -> 2410 | P29: 35 | Q29: 10 | R29: 40 | S29: 0.75 | T29: 15 | U29: 210 | V29: 10 | W29: 90 | X29: 960
A30: W | B30: LCBR | C30: 230 | D30: 5 | E30: Audi A6 or similar | F30: 122 | G30: of:=[.F30]+30 -> 152 | H30: 122 | I30: of:=[.H30]+30 -> 152 | J30: of:=[.L30]*7 -> 770 | K30: of:=[.M30]*7 -> 980 | L30: 110 | M30: of:=[.L30]+30 -> 140 | N30: 2690 | O30: of:=[.N30]+240 -> 2930 | P30: 35 | Q30: 10 | R30: 40 | S30: 0.75 | T30: 15 | U30: 210 | V30: 10 | W30: 90 | X30: 960
A31: Special Vehicles
A32: FX | B32: DBAR | C32: 65 | D32: 5 | E32: Renault Megane Coupe (2 Doors) or similar | F32: 17 | G32: of:=[.F32]+12 -> 29 | H32: 17 | I32: of:=[.H32]+12 -> 29 | J32: of:=[.L32]*7 -> 105 | K32: of:=[.M32]*7 -> 189 | L32: 15 | M32: of:=[.L32]+12 -> 27 | N32: 760 | O32: of:=[.N32]+180 -> 940 | P32: 11 | Q32: 5 | R32: 12 | S32: 0.5 | T32: 10 | U32: 100 | V32: 5 | W32: 60 | X32: 475
A33: T | B33: CPMR | C33: 200 | D33: 5 | E33: VW Caddy Man. or similar | F33: 39 | G33: of:=[.F33]+30 -> 69 | H33: 39 | I33: of:=[.H33]+30 -> 69 | J33: of:=[.L33]*7 -> 245 | K33: of:=[.M33]*7 -> 455 | L33: 35 | M33: of:=[.L33]+30 -> 65 | N33: 1050 | O33: of:=[.N33]+240 -> 1290 | P33: 15 | Q33: 10 | R33: 20 | S33: 0.75 | T33: 10 | U33: 100 | V33: 5 | W33: 60 | X33: 475
A34: J | B34: SFBR | C34: 100 | D34: 5 | E34: Hyundai Tucson Aut. or similar | F34: 42 | G34: of:=[.F34]+30 -> 72 | H34: 42 | I34: of:=[.H34]+30 -> 72 | J34: of:=[.L34]*7 -> 266 | K34: of:=[.M34]*7 -> 476 | L34: 38 | M34: of:=[.L34]+30 -> 68 | N34: 1240 | O34: of:=[.N34]+240 -> 1480 | P34: 15 | Q34: 10 | R34: 20 | S34: 0.75 | T34: 10 | U34: 150 | V34: 7 | W34: 70 | X34: 715
A35: O | B35: LFBR | C35: 150 | D35: 5 | E35: Ford Edge Aut. or similar | F35: 74 | G35: of:=[.F35]+30 -> 104 | H35: 74 | I35: of:=[.H35]+30 -> 104 | J35: of:=[.L35]*7 -> 469 | K35: of:=[.M35]*7 -> 679 | L35: 67 | M35: of:=[.L35]+30 -> 97 | N35: 2250 | O35: of:=[.N35]+300 -> 2550 | P35: 35 | Q35: 10 | R35: 40 | S35: 0.75 | T35: 15 | U35: 210 | V35: 10 | W35: 90 | X35: 960
A36: U | B36: IVAR | C36: 210 | D36: 7 | E36: Opel Zafira Aut. or similar | F36: 39 | G36: of:=[.F36]+30 -> 69 | H36: 39 | I36: of:=[.H36]+30 -> 69 | J36: of:=[.L36]*7 -> 245 | K36: of:=[.M36]*7 -> 455 | L36: 35 | M36: of:=[.L36]+30 -> 65 | N36: 1220 | O36: of:=[.N36]+300 -> 1520 | P36: 15 | Q36: 10 | R36: 20 | S36: 0.75 | T36: 15 | U36: 210 | V36: 10 | W36: 90 | X36: 715
A37: V | B37: SVAR | C37: 220 | D37: 7 | E37: Mitsubishi Outlander Aut. or similar | F37: 58 | G37: of:=[.F37]+30 -> 88 | H37: 58 | I37: of:=[.H37]+30 -> 88 | J37: of:=[.L37]*7 -> 364 | K37: of:=[.M37]*7 -> 574 | L37: 52 | M37: of:=[.L37]+30 -> 82 | N37: 1550 | O37: of:=[.N37]+300 -> 1850 | P37: 15 | Q37: 10 | R37: 20 | S37: 0.75 | T37: 15 | U37: 210 | V37: 10 | W37: 90 | X37: 960
A38: V8 | B38: FVAR | C38: 225 | D38: 8 | E38: Kia Carnival Aut. or similar | F38: 83 | G38: of:=[.F38]+30 -> 113 | H38: 83 | I38: of:=[.H38]+30 -> 113 | J38: of:=[.L38]*7 -> 525 | K38: of:=[.M38]*7 -> 735 | L38: 75 | M38: of:=[.L38]+30 -> 105 | N38: 1870 | O38: of:=[.N38]+300 -> 2170 | P38: 35 | Q38: 10 | R38: 40 | S38: 0.75 | T38: 15 | U38: 210 | V38: 10 | W38: 90 | X38: 960
A39: Y | B39: FVMR | C39: 250 | D39: 9 | E39: Renault Traffic Man. or similar | F39: 55 | G39: of:=[.F39]+30 -> 85 | H39: 55 | I39: of:=[.H39]+30 -> 85 | J39: of:=[.L39]*7 -> 343 | K39: of:=[.M39]*7 -> 553 | L39: 49 | M39: of:=[.L39]+30 -> 79 | N39: 1600 | O39: of:=[.N39]+300 -> 1900 | P39: 35 | Q39: 10 | R39: 40 | S39: 0.75 | T39: 15 | U39: 210 | V39: 10 | W39: 90 | X39: 960
A40: Z | B40: LVAR | C40: 260 | D40: 9 | E40: VW Transporter Aut. or similar | F40: 95 | G40: of:=[.F40]+30 -> 125 | H40: 95 | I40: of:=[.H40]+30 -> 125 | J40: of:=[.L40]*7 -> 602 | K40: of:=[.M40]*7 -> 812 | L40: 86 | M40: of:=[.L40]+30 -> 116 | N40: 2120 | O40: of:=[.N40]+300 -> 2420 | P40: 35 | Q40: 10 | R40: 40 | S40: 0.75 | T40: 15 | U40: 210 | V40: 10 | W40: 90 | X40: 960
A42: Season Periods (Defined by Pickup Date)
A43: Low Season: Apr 10 - Jul 14 2018; Aug 26 - Dec 19 2018; Jan 6 - Apr 13 2019; Apr 29 - Jul 14 2019; Aug 26 - Dec 19 2019;
A44: High Season: Jul 15 - Aug 25 2018; Dec 20 2018 - Jan 5 2019; Apr 14 - 28 2019; Jul 15 - Aug 25 2019;